{
  "title": "Teaching brief pending subject confirmation",
  "genre": "teaching",
  "audience": {
    "who": "Corporate employees",
    "knows": "Prior knowledge not supplied",
    "cares_about": "Workplace relevance provisionally assumed; task and stakes unconfirmed"
  },
  "outcome": "Pending subject confirmation: employees can choose and justify an action in the agreed workplace situation, then use that reasoning in their own task.",
  "through_line": "Pending subject confirmation: a workplace problem becomes actionable when employees see the governing idea at work, test their choice, and return able to resolve it.",
  "arc_plan": [
    {
      "role": "hook",
      "what": "Establish a recognisable workplace problem through a recurring cartoon example, leaving a decision unresolved rather than opening with terminology.",
      "no_material": true,
      "needs": "The subject and a relevant workplace situation supported by requester statements or approved material"
    },
    {
      "role": "promise",
      "what": "Make the practical action employees will be able to take the reason to continue, rather than offering a subject agenda.",
      "no_material": true,
      "needs": "The intended workplace action and its success criterion"
    },
    {
      "role": "bridge",
      "what": "Connect what employees already do in the recurring situation to the unfamiliar idea needed for their decision.",
      "no_material": true,
      "needs": "Confirmed prior knowledge and its relationship to the subject"
    },
    {
      "role": "build",
      "what": "Make the governing idea visible in the workplace example before naming it, then establish the boundary relevant to the decision.",
      "no_material": true,
      "needs": "Approved explanations of the idea, its boundaries, and its application to the example"
    },
    {
      "role": "check",
      "what": "Require employees to choose the next action in the recurring situation and justify it using the taught idea.",
      "no_material": true,
      "needs": "A grounded decision, answer criterion, and supporting reasoning"
    },
    {
      "role": "apply",
      "what": "Connect the example's reasoning to the employee's actual task without extending it beyond established limits.",
      "no_material": true,
      "needs": "An appropriate transfer task and limits on applying the idea"
    },
    {
      "role": "payoff",
      "what": "Return to the unresolved workplace problem and demonstrate how the employee's decision now resolves it.",
      "no_material": true,
      "needs": "A supported resolution consistent with the intended outcome"
    }
  ],
  "must_cover": [
    {
      "what": "Teaching addressed to corporate employees, with practical workplace relevance",
      "from_user": true
    },
    {
      "what": "A mentor persona supporting employee reasoning without a classroom manner",
      "from_user": true
    },
    {
      "what": "The requested cartoon-story styling and a woman presenter",
      "from_user": true
    },
    {
      "what": "Captions accompanying the spoken teaching",
      "from_user": true
    }
  ],
  "must_avoid": [
    "Inventing a subject, workplace rule, learning objective, or factual explanation to fill missing material",
    "Opening with terminology or an agenda",
    "Following source order instead of the learner's decision",
    "Disconnected examples instead of a recurring example",
    "Testing trivia rather than the intended action",
    "Unsupported statistics, learning-styles claims, or invented quotations presented as real",
    "A childish cartoon manner or a teacher addressing pupils",
    "Implying that teaching content or the proposed outcome has been verified",
    "Decorative movement competing with the idea being taught"
  ],
  "example_posture": "Use a recurring workplace example after the subject and task are confirmed. Label constructed situations as illustrative, not real incidents. Keep explanations and the correct decision faithful to approved material; invent no organisational practices, consequences, or quotations.",
  "visual_direction": "Honour the cartoon-story request through a workplace situation whose relevant relationships visibly change as the employee reasons. Keep the woman presenter supporting rather than dominating, and captions easy to follow. Retain a straightforward illustrated explanation as an alternative to acted cartoon situations; no explicit choice between those treatments was supplied.",
  "voice_note": "Express the requested mentor persona as a capable colleague helping another colleague reason through a practical choice. Be warm and direct, avoid schoolroom praise, and introduce terminology after its purpose is visible.",
  "grounding_posture": "faithful",
  "open_questions": [
    "What subject and workplace action should this lesson address? Neither was supplied; the outcome and through-line remain provisional.",
    "Is this topic-led or source-led? No mode, source material, or approved knowledge sheet was supplied. No factual teaching content has been verified.",
    "What do employees already know, and why does this task matter to them?",
    "Which subject requirements must reviewers check? Current must_cover entries capture production requirements, not verified teaching content.",
    "What grounded situation, decision criterion, and resolution fit the requested short runtime?",
    "Does 'story-cartoon' mean illustrated situations or acting characters? No explicit story-depth or people-treatment answer was supplied; keep both available."
  ],
  "provenance": {
    "inferred": [
      "title: provisional label for the missing subject",
      "audience.cares_about: workplace relevance inferred from audience, not confirmed stakes",
      "outcome and through_line: provisional teaching intentions, not supplied learning objectives or verified claims",
      "arc_plan.what: genre-derived instructional functions adapted to the audience and styling; all blocked on missing subject material",
      "must_cover: priorities selected from the request; workplace relevance is an editorial interpretation",
      "must_avoid: genre refusals and safeguards against inventing missing content",
      "example_posture: genre-derived approach; no actual example supplied",
      "visual_direction: changing relationships and alternative treatments are editorial choices; supporting presenter role interprets the requested presentation balance",
      "voice_note: colleague-like expression of the requested mentor persona"
    ]
  },
  "look": {
    "note": "story-cartoon"
  }
}
