{
  "arc_plan": [
    {
      "role": "hook",
      "what": "Present an everyday workplace tension where an employee receives conflicting operational requests and hesitates on which task takes precedence"
    },
    {
      "role": "promise",
      "what": "Demonstrate that a structured decision filter enables any employee to determine task priority and take decisive action without waiting for managerial escalation"
    },
    {
      "what": "Connect the common reflex of pausing work or pinging a manager to the underlying operating principle of evaluating urgency against operational impact",
      "role": "bridge"
    },
    {
      "what": "Construct the decision criteria step by step through a running workplace scenario, naming each evaluation filter only after showing it in action",
      "role": "build"
    },
    {
      "what": "Challenge the viewer with a realistic scenario containing ambiguous deadlines to test whether they can select the appropriate course of action",
      "role": "check"
    },
    {
      "what": "Illustrate how the validated framework resolves a complex edge case involving cross-functional dependencies and sudden schedule shifts",
      "role": "apply"
    },
    {
      "role": "payoff",
      "what": "Return to the opening workplace dilemma from the hook and resolve it smoothly using the established framework, showing the bottleneck cleared"
    }
  ],
  "audience": {
    "who": "corporate employees",
    "knows": "basic company communication channels and general office workflows",
    "cares_about": "handling daily workloads smoothly without second-guessing priorities or stalling projects"
  },
  "visual_direction": "Narrative illustrated frames depicting an employee at a workspace dealing with competing incoming demands, accompanied by visual sequences that show operational flow. Visual kinds include an individual in an everyday workplace situation, a status indicator that visibly changes state, a sequence advancing through stages of action, and an operational state shown before and after applying the decision criteria. Keep backgrounds calm with a clear focal element in view.",
  "through_line": "Clear prioritization criteria allow employees to resolve conflicting demands swiftly, keeping team workflows moving without unnecessary managerial escalation",
  "provenance": {
    "inferred": [
      "title",
      "outcome",
      "through_line",
      "audience.knows",
      "audience.cares_about",
      "must_cover"
    ]
  },
  "example_posture": "Anchor the lesson in a single running corporate scenario following a colleague facing conflicting project deadlines and incoming requests. Introduce concepts only after the character experiences them in the workflow. Avoid multiple disconnected vignettes or artificial classroom hypotheticals.",
  "title": "Workplace Decision Standards for Corporate Teams",
  "voice_note": "Speak as an experienced, capable colleague offering practical counsel rather than a lecturer delivering formal instruction. Keep sentences short, conversational, and direct, emphasizing clear operational judgement without condescension.",
  "grounding_posture": "faithful",
  "open_questions": [
    "The request did not specify a topic or curriculum module; does the proposed focus on workplace prioritization and decision standards match the training goal?",
    "Should specific enterprise tools or departmental workflows be referenced by name in the running scenario once established by the knowledge sheet?",
    "Are there company-specific escalation thresholds or approval paths that the lesson must reflect?"
  ],
  "outcome": "Prioritise competing work requests independently and resolve routine task conflicts without escalating to management",
  "must_cover": [
    {
      "from_knowledge": true,
      "what": "Evaluating task urgency versus organizational impact when requests collide"
    },
    {
      "what": "Identifying common operational bottlenecks caused by delayed prioritization decisions",
      "from_knowledge": true
    },
    {
      "from_knowledge": true,
      "what": "Applying a systematic decision filter to determine task execution order"
    },
    {
      "from_knowledge": true,
      "what": "Communicating priority choices clearly to stakeholders across teams"
    },
    {
      "what": "Distinguishing between genuine escalation triggers and routine trade-offs",
      "from_knowledge": true
    }
  ],
  "must_avoid": [
    "Opening by explaining term meanings, an agenda outline, or corporate greetings",
    "Throat-clearing phrases such as in this video we will or let us dive in",
    "Unsubstantiated numerical findings presented without grounding",
    "Claims based on debunked concepts such as learning styles",
    "Fabricated endorsements or artificial corporate testimonials presented as genuine",
    "Using multiple disconnected examples instead of a single running scenario",
    "Testing trivial trivia rather than practical decision-making",
    "A patronising teacher tone rather than a capable colleague persona",
    "Abstract policy mandates divorced from everyday workplace reality"
  ],
  "genre": "teaching"
}
