{
  "must_cover": [
    {
      "what": "The difference between critiquing personality and critiquing behavior",
      "from_knowledge": true
    },
    {
      "what": "Connecting the behavior to a specific impact on the work",
      "from_knowledge": true
    },
    {
      "from_knowledge": true,
      "what": "Collaborating on future actions rather than dwelling on the past"
    }
  ],
  "voice_note": "Supportive, experienced, and practical. The mentor guides the viewer through the awkwardness of feedback with empathy, but remains firm on the need for professional clarity.",
  "arc_plan": [
    {
      "what": "A scenario where a manager gives vague feedback about a colleague's attitude, resulting in defensiveness and no change in their actual work.",
      "role": "hook"
    },
    {
      "role": "promise",
      "what": "A commitment that focusing on observable actions rather than character attributes will make feedback a catalyst for real change."
    },
    {
      "role": "build",
      "what": "A breakdown showing how to translate a character critique into an observation of specific and measurable behavior."
    },
    {
      "role": "build",
      "what": "A demonstration of connecting the observed behavior to its actual impact on a task, removing the need to guess the colleague's intent."
    },
    {
      "role": "build",
      "what": "A step detailing the shift from criticizing past actions to collaborating on a different approach for the next task."
    },
    {
      "role": "check",
      "what": "A scenario challenging the viewer to select the feedback option that correctly targets a behavior instead of a feeling."
    },
    {
      "role": "payoff",
      "what": "A return to the opening manager scenario, now resolved through behavior-focused feedback, leaving the relationship intact and the work improved."
    }
  ],
  "genre": "teaching",
  "example_posture": "A running example of a colleague receiving feedback about a recurring action, showing the before and after.",
  "through_line": "Feedback is a tool to change future actions, not a verdict on past intentions, and it works best when focused entirely on observable behavior.",
  "grounding_posture": "faithful",
  "visual_direction": "A person in a situation, a value that visibly changes, a before and after showing a clear contrast between abstract criticism and concrete observation.",
  "outcome": "Viewers can frame their feedback around specific behaviors and business impacts rather than personality traits.",
  "must_avoid": [
    "Statistics without a source",
    "Learning styles claims",
    "Invented statements presented as real",
    "A tour of the source in its own order",
    "A testing on trivia",
    "Saying in this video we will",
    "Opening with a dictionary meaning or an agenda slide"
  ],
  "title": "Feedback for Behavior Change",
  "open_questions": [
    "Will the organization prefer a specific behavioral framework or a general approach?"
  ],
  "provenance": {
    "inferred": [
      "audience.knows",
      "audience.cares_about",
      "through_line",
      "outcome",
      "example_posture",
      "voice_note"
    ]
  },
  "audience": {
    "cares_about": "improving performance without ruining working relationships",
    "who": "corporate employees",
    "knows": "that giving feedback often feels personal and awkward"
  }
}
